{
  "schema_version": "1.0.0",
  "image_id": "FIXTURE_ART_001__exterior__1",
  "artifact_id": "FIXTURE_ART_001",
  "image_path": "fixture_site/FIXTURE_ART_001__exterior__1.jpg",
  "image_sha256": "0123456789abcdef0123456789abcdef0123456789abcdef0123456789abcdef",
  "view": "exterior",
  "image_width_px": 1200,
  "image_height_px": 900,
  "scale_bar_present": "yes",
  "source": "other",
  "source_reference": "SYNTHETIC TEST FIXTURE - not a real source",
  "collection": "not_applicable",
  "catalogue_reference": "not_applicable",
  "license": "not_applicable",
  "redistributable": "yes",
  "rights_notes": "Synthetic fixture. No real image and no real rights are involved.",
  "site": "FIXTURE_SITE_A",
  "site_district": "not_applicable",
  "site_state": "not_applicable",
  "excavation_reference": "not_applicable",
  "stratigraphic_context": "FIXTURE layer 3",
  "context_reliability": "excavated_stratified",
  "artifact_type": "pottery_sherd",
  "pottery_type": "unknown",
  "sherd_part": "body",
  "fabric_notes": "not_available",
  "surface_treatment": "unknown",
  "inscription_present": "yes",
  "script_type": "tamil_brahmi",
  "script_type_other_detail": "not_applicable",
  "label_source": "expert_annotation",
  "label_confidence": "high",
  "inscription_technique": "incised_post_firing",
  "inscription_placement": "exterior_body",
  "inscription_regions": [
    {
      "x": 100,
      "y": 200,
      "w": 300,
      "h": 80,
      "region_label": "inscription",
      "annotator": "FIXTURE_ANNOTATOR",
      "notes": "Synthetic region. Coordinates are arbitrary."
    }
  ],
  "character_count_visible": 4,
  "transcription": "FIXTURE_TRANSCRIPTION_PLACEHOLDER",
  "transcription_encoding": "romanized",
  "transliteration": "FIXTURE_TRANSLITERATION_PLACEHOLDER",
  "transliteration_scheme": "other",
  "translation_en": "FIXTURE_TRANSLATION_PLACEHOLDER",
  "translation_ta": "not_available",
  "reading_status": "unknown",
  "alternative_readings": [
    "FIXTURE_ALTERNATIVE_A (Fictitious 0000)",
    "FIXTURE_ALTERNATIVE_B; contains a semicolon on purpose (Fictitious 0000)"
  ],
  "reading_source": "SYNTHETIC TEST FIXTURE - no real reading",
  "dating_text": "FIXTURE placeholder range - not a real date attribution",
  "dating_lower_year": -200,
  "dating_upper_year": 100,
  "dating_basis": ["stratigraphy", "palaeography"],
  "dating_reliability": "project_estimate",
  "dating_source": "SYNTHETIC TEST FIXTURE - no real source",
  "publication": "not_applicable",
  "publication_doi_or_url": "not_applicable",
  "split": "train",
  "split_exclusion_reason": "not_applicable",
  "verification_status": "unverified",
  "annotator": "FIXTURE_ANNOTATOR",
  "annotation_date": "2026-09-22",
  "notes": "SYNTHETIC TEST FIXTURE. Not archaeological data. See tests/fixtures/README.md."
}
